{
  "$schema": "../../Packages/Beckhoff.TwinCAT.HMI.Framework.12.744.3/runtimes/native1.12-tchmi/Schema/TchmiConfig.Schema.json",
  "basePath": "./framework",
  "scaleMode": "None",
  "startupView": "Desktop.view",
  "loginPage": "",
  "tcHmiServer": {
    "websocketIntervalTime": 500,
    "websocketTimeout": 20000,
    "websocketSystemTimeout": 60000,
    "websocketSubscriptionMode": "Change"
  },
  "activeTheme": "Base",
  "themes": {
    "Base": {
      "resources": [
        {
          "name": "Themes/Base/Base.theme",
          "description": "",
          "type": "ThemedValues"
        },
        {
          "name": "Themes/Base/BaseStyle.css",
          "description": "",
          "type": "Stylesheet"
        }
      ],
      "replacesThemeForControls": []
    }
  },
  "dependencyFiles": [
    {
      "name": "Fonts/Fonts.css",
      "description": "",
      "type": "Stylesheet"
    },
    {
      "name": "Function/LoadViewFromQuery.js",
      "description": "",
      "type": "JavaScript"
    }
  ],
  "userControls": [],
  "content": [],
  "views": [
    {
      "url": "Desktop.view",
      "preload": false,
      "keepAlive": false
    },
    {
      "url": "ExtendedDesktop.view",
      "preload": false,
      "keepAlive": false
    }
  ],
  "userFunctions": [
    {
      "url": "Function\\LoadViewFromQuery.js"
    }
  ],
  "symbols": {
    "internal": {}
  },
  "trigger": [
    {
      "event": "onInitialized",
      "actions": [
        {
          "objectType": "Function",
          "active": true,
          "fn": "TcHmi.Functions.demo_multi_screen.LoadViewFromQuery",
          "fnParams": [],
          "asyncWait": true
        }
      ]
    }
  ],
  "actionTemplates": [],
  "languages": {
    "de-DE": "Localization\\de-DE.localization",
    "en-US": "Localization\\en-US.localization"
  },
  "languageFallback": "",
  "disableLoadingOptimization": false,
  "creatorSettings": {
    "viewport": {
      "defaultWidth": 800,
      "defaultHeight": 600
    }
  },
  "packages": [
    {
      "name": "Beckhoff.TwinCAT.HMI.Controls",
      "basePath": "/Beckhoff.TwinCAT.HMI.Controls"
    },
    {
      "name": "Beckhoff.TwinCAT.HMI.Framework",
      "basePath": "/framework"
    },
    {
      "name": "Beckhoff.TwinCAT.HMI.Functions",
      "basePath": "/Beckhoff.TwinCAT.HMI.Functions"
    }
  ]
}